#,Feature Dimension,As an Item Attribute (What the item is),As a User Preference (What the user likes)
1,Modern / Minimalist,"The item has a clean, simple, and modern design.","The user prefers minimalist aesthetics, simplicity, and ""less is more."""
2,Classic / Traditional,"The item has a timeless, established, or ornate design.","The user values heritage, timelessness, and classic styles."
3,Bold / Vibrant,"The item uses bright colors, makes a strong statement, or has high-contrast elements.","The user is expressive and drawn to eye-catching, high-energy items."
4,Subtle / Muted,"The item uses neutral tones, has an understated design, and blends in.","The user prefers subtlety, quietness, and items that are not ""loud."""
5,Rustic / Natural,"The item is made of natural materials (wood, stone) or has an organic feel.","The user enjoys nature, ""cabin"" or ""farmhouse"" aesthetics, and authenticity."
6,High-Tech / Innovative,"The item features cutting-edge technology, new features, or is complex.","The user is an ""early adopter"" who values new technology and R&D."
7,Simple / Utilitarian,"The item is ""low-tech,"" easy to use, and focuses on a single function.","The user values ""it just works"" simplicity and avoids complex gadgets."
8,Durable / Rugged,"The item is built to last, can withstand rough use, and is heavy-duty.","The user values longevity, reliability, and ""buy it for life"" quality."
9,Portable / Compact,"The item is small, lightweight, and designed for travel or on-the-go use.","The user has a mobile lifestyle, travels frequently, or lives in a small space."
10,Luxury / Premium,"The item is expensive, exclusive, and associated with high-end brand prestige.","The user is brand-conscious, seeks status, and prioritizes quality/exclusivity over price."
11,Budget / Value-Oriented,The item is inexpensive and provides good value for its low price.,"The user is price-sensitive, enjoys finding deals, and prioritizes saving money."
12,Fast-Paced / Action,"(For media/games) The item is high-energy, exciting, and full of action.","The user seeks thrills, has a short attention span, and enjoys excitement."
13,Slow-Burn / Cerebral,"(For media/games) The item is thoughtful, complex, and builds its narrative slowly.","The user is patient, enjoys intellectual challenges, and likes deep narratives."
14,Comedic / Lighthearted,"The item is funny, positive, and does not take itself seriously.","The user seeks to relax, laugh, and wants to be uplifted."
15,Dramatic / Serious,"The item deals with heavy themes, complex emotions, and high stakes.","The user appreciates deep emotional exploration and serious, impactful stories."
16,Nostalgic / Retro,The item is a throwback to a previous era or has a vintage design.,"The user enjoys reminiscing, values the past, and likes vintage aesthetics."
17,Mainstream / Popular,"The item is widely known, trendy, and has mass appeal.",The user follows trends and feels comfortable with popular choices.
18,Niche / Obscure,"The item is for a specific hobby or is a ""hidden gem"" with a cult following.","The user is a deep hobbyist, avoids trends, and likes ""being in the know."""
19,Social / Collaborative,"The item is intended for group use (e.g., a board game, a large sofa).","The user is extroverted, enjoys group activities, and often entertains guests."
20,Solo / Individual,"The item is intended for a single person's use (e.g., headphones, a journal).","The user is introverted, values ""me time,"" and enjoys solitary activities."